{"R2-T05_allowed_to_start":false,"R3_allowed_to_start":false,"cell_count":72,"decision_unit_count":4,"formal_task_completed":false,"hard_gate_report_sha256":"c5be6b074294e60e00b1fb7dc5f09ef67520e40445028573f273df1975fa26bb","phase":"A","run_id":"R2-T04-20260713T120000Z","status":"awaiting_user_decision","task_id":"R2-T04"}
